code,tickers,name,industry
A,A,Agilent Technologies Inc. Common Stock,Biotechnology: Laboratory Analytical Instruments
AA,AA,Alcoa Corporation Common Stock,Aluminum
AACG,AACG,ATA Creativity Global American Depositary Shares,Other Consumer Services
AACT,AACT,Ares Acquisition Corporation II Class A Ordinary Shares,Blank Checks
AADI,AADI,Aadi Bioscience Inc. Common Stock,Biotechnology: Pharmaceutical Preparations
AAL,AAL,American Airlines Group Inc. Common Stock,Air Freight/Delivery Services
AAM,AAM,AA Mission Acquisition Corp. Class A Ordinary Shares,NA
AAME,AAME,Atlantic American Corporation Common Stock,Life Insurance
AAOI,AAOI,Applied Optoelectronics Inc. Common Stock,Semiconductors
AAON,AAON,AAON Inc. Common Stock,Industrial Machinery/Components
AAP,AAP,Advance Auto Parts Inc.,Auto & Home Supply Stores
AAPL,AAPL,Apple Inc. Common Stock,Computer Manufacturing
AAT,AAT,American Assets Trust Inc. Common Stock,Real Estate Investment Trusts
AB,AB,AllianceBernstein Holding L.P.  Units,Investment Managers
ABAT,ABAT,American Battery Technology Company Common Stock,Metal Mining
ABBV,ABBV,AbbVie Inc. Common Stock,Biotechnology: Pharmaceutical Preparations
ABCB,ABCB,Ameris Bancorp Common Stock,Major Banks
ABCL,ABCL,AbCellera Biologics Inc. Common Shares,Pharmaceuticals and Biotechnology
ABEO,ABEO,Abeona Therapeutics Inc. Common Stock,Biotechnology: Pharmaceutical Preparations
ABEV,ABEV,Ambev S.A. American Depositary Shares (Each representing 1 Common Share),Beverages (Production/Distribution)
ABG,ABG,Asbury Automotive Group Inc Common Stock,Retail-Auto Dealers and Gas Stations
ABL,ABL,Abacus Life Inc. Class A Common Stock,Investment Managers
ABLLL,ABLLL,Abacus Life Inc. 9.875% Fixed Rate Senior Notes due 2028,Investment Managers
ABLLW,ABLLW,Abacus Life Inc. Warrant,Investment Managers
ABLV,ABLV,Able View Global Inc. Class B Ordinary Shares,Other Consumer Services
ABLVW,ABLVW,Able View Global Inc. Warrant,Other Consumer Services
ABM,ABM,ABM Industries Incorporated Common Stock,Diversified Commercial Services
ABNB,ABNB,Airbnb Inc. Class A Common Stock,Diversified Commercial Services
ABOS,ABOS,Acumen Pharmaceuticals Inc. Common Stock,Biotechnology: Biological Products (No Diagnostic Substances)
ABP,ABP,Abpro Holdings Inc Common Stock,Biotechnology: Pharmaceutical Preparations
ABPWW,ABPWW,Abpro Holdings Inc. Warrant,Biotechnology: Pharmaceutical Preparations
ABR,ABR,Arbor Realty Trust Common Stock,Real Estate Investment Trusts
ABR^D,ABR^D,Arbor Realty Trust 6.375% Series D Cumulative Redeemable Preferred Stock Liquidation Preference $25.00 per Share,NA
ABR^E,ABR^E,Arbor Realty Trust 6.25% Series E Cumulative Redeemable Preferred Stock,NA
ABR^F,ABR^F,Arbor Realty Trust 6.25% Series F Fixed-to-Floating Rate Cumulative Redeemable Preferred Stock Liquidation Preference $25.00 per share,NA
ABSI,ABSI,Absci Corporation Common Stock,Biotechnology: Commercial Physical & Biological Resarch
ABT,ABT,Abbott Laboratories Common Stock,Biotechnology: Pharmaceutical Preparations
ABTS,ABTS,Abits Group Inc Ordinary Shares,Computer Software: Programming Data Processing
ABUS,ABUS,Arbutus Biopharma Corporation Common Stock,Biotechnology: Pharmaceutical Preparations
ABVC,ABVC,ABVC BioPharma Inc. Common Stock,Biotechnology: Pharmaceutical Preparations
ABVE,ABVE,Above Food Ingredients Inc. Common Stock,Packaged Foods
ABVEW,ABVEW,Above Food Ingredients Inc. Warrants,Packaged Foods
ABVX,ABVX,Abivax SA American Depositary Shares,Biotechnology: Pharmaceutical Preparations
AC,AC,Associated Capital Group Inc. Common Stock,Investment Bankers/Brokers/Service
ACA,ACA,Arcosa Inc. Common Stock,Metal Fabrications
ACAD,ACAD,ACADIA Pharmaceuticals Inc. Common Stock,Biotechnology: Pharmaceutical Preparations
ACB,ACB,Aurora Cannabis Inc. Common Shares,Medicinal Chemicals and Botanical Products
ACCD,ACCD,Accolade Inc. Common Stock,Business Services
ACCO,ACCO,Acco Brands Corporation Common Stock,Publishing
ACDC,ACDC,ProFrac Holding Corp. Class A Common Stock,Oilfield Services/Equipment
ACEL,ACEL,Accel Entertainment Inc.,Services-Misc. Amusement & Recreation
ACET,ACET,Adicet Bio Inc. Common Stock,Biotechnology: Pharmaceutical Preparations
ACGL,ACGL,Arch Capital Group Ltd. Common Stock,Property-Casualty Insurers
ACGLN,ACGLN,Arch Capital Group Ltd. Depositary Shares each Representing a 1/1000th Interest in a 4.550% Non-Cumulative Preferred Share Series G,Property-Casualty Insurers
ACGLO,ACGLO,Arch Capital Group Ltd. Depositary Shares Each Representing 1/1000th Interest in a Share of 5.45% Non-Cumulative Preferred Shares Series F,Property-Casualty Insurers
ACHC,ACHC,Acadia Healthcare Company Inc. Common Stock,Medical Specialities
ACHL,ACHL,Achilles Therapeutics plc American Depositary Shares,Biotechnology: Biological Products (No Diagnostic Substances)
ACHR,ACHR,Archer Aviation Inc. Class A Common Stock,Aerospace
ACHV,ACHV,Achieve Life Sciences Inc. Common Shares,Biotechnology: In Vitro & In Vivo Diagnostic Substances
ACI,ACI,Albertsons Companies Inc. Class A Common Stock,Food Chains
ACIC,ACIC,American Coastal Insurance Corporation Common Stock,Property-Casualty Insurers
ACIU,ACIU,AC Immune SA Common Stock,Biotechnology: Pharmaceutical Preparations
ACIW,ACIW,ACI Worldwide Inc. Common Stock,Computer Software: Prepackaged Software
ACLS,ACLS,Axcelis Technologies Inc. Common Stock,Industrial Machinery/Components
ACLX,ACLX,Arcellx Inc. Common Stock,Biotechnology: Biological Products (No Diagnostic Substances)
ACM,ACM,AECOM Common Stock,Military/Government/Technical
ACMR,ACMR,ACM Research Inc. Class A Common Stock,Industrial Machinery/Components
ACN,ACN,Accenture plc Class A Ordinary Shares (Ireland),Business Services
ACNB,ACNB,ACNB Corporation Common Stock,Major Banks
ACNT,ACNT,Ascent Industries Co. Common Stock,Steel/Iron Ore
ACOG,ACOG,Alpha Cognition Inc. Common Stock,NA
ACON,ACON,Aclarion Inc. Common Stock,Medical Specialities
ACONW,ACONW,Aclarion Inc. Warrant,Medical Specialities
ACP,ACP,abrdn Income Credit Strategies Fund Common Shares,Investment Managers
ACP^A,ACP^A,abrdn Income Credit Strategies Fund 5.250% Series A Perpetual Preferred Stock,NA
ACR,ACR,ACRES Commercial Realty Corp. Common Stock,Real Estate Investment Trusts
ACR^C,ACR^C,ACRES Commercial Realty Corp. 8.625% Fixed-to-Floating Series C Cumulative Redeemable Preferred Stock,NA
ACR^D,ACR^D,ACRES Commercial Realty Corp. 7.875% Series D Cumulative Redeemable Preferred Stock,NA
ACRE,ACRE,Ares Commercial Real Estate Corporation Common Stock,Real Estate Investment Trusts
ACRS,ACRS,Aclaris Therapeutics Inc. Common Stock,Biotechnology: Pharmaceutical Preparations
ACRV,ACRV,Acrivon Therapeutics Inc. Common Stock,Biotechnology: Pharmaceutical Preparations
ACT,ACT,Enact Holdings Inc. Common Stock,Specialty Insurers
ACTG,ACTG,Acacia Research Corporation (Acacia Tech) Common Stock,Multi-Sector Companies
ACTU,ACTU,Actuate Therapeutics Inc. Common stock,Biotechnology: Pharmaceutical Preparations
ACU,ACU,Acme United Corporation. Common Stock,Industrial Machinery/Components
ACV,ACV,Virtus Diversified Income & Convertible Fund Common Shares of Beneficial Interest,Finance/Investors Services
ACVA,ACVA,ACV Auctions Inc. Class A Common Stock,Business Services
ACXP,ACXP,Acurx Pharmaceuticals Inc. Common Stock,Biotechnology: Pharmaceutical Preparations
ADAG,ADAG,Adagene Inc. American Depositary Shares,Biotechnology: Pharmaceutical Preparations
ADAP,ADAP,Adaptimmune Therapeutics plc American Depositary Shares,Biotechnology: Biological Products (No Diagnostic Substances)
ADBE,ADBE,Adobe Inc. Common Stock,Computer Software: Prepackaged Software
ADC,ADC,Agree Realty Corporation Common Stock,Real Estate Investment Trusts
ADC^A,ADC^A,Agree Realty Corporation Depositary Shares each representing 1/1000th of a 4.250% Series A Cumulative Redeemable Preferred Stock,NA
ADCT,ADCT,ADC Therapeutics SA Common Shares,Biotechnology: Pharmaceutical Preparations
ADD,ADD,Color Star Technology Co. Ltd. Class A Ordinary Shares,Engineering & Construction
ADEA,ADEA,Adeia Inc. Common Stock,Computer Software: Prepackaged Software
ADGM,ADGM,Adagio Medical Holdings Inc Common Stock,Medical/Dental Instruments
ADI,ADI,Analog Devices Inc. Common Stock,Semiconductors
ADIL,ADIL,Adial Pharmaceuticals Inc Common Stock,Biotechnology: Pharmaceutical Preparations
ADM,ADM,Archer-Daniels-Midland Company Common Stock,Packaged Foods
ADMA,ADMA,ADMA Biologics Inc Common Stock,Biotechnology: Biological Products (No Diagnostic Substances)
ADN,ADN,Advent Technologies Holdings Inc. Class A Common Stock,Industrial Machinery/Components
ADNT,ADNT,Adient plc Ordinary Shares,Auto Parts:O.E.M.
ADNWW,ADNWW,Advent Technologies Holdings Inc. Warrant,Industrial Machinery/Components
ADP,ADP,Automatic Data Processing Inc. Common Stock,EDP Services
ADPT,ADPT,Adaptive Biotechnologies Corporation Common Stock,Biotechnology: Biological Products (No Diagnostic Substances)
ADSE,ADSE,ADS-TEC ENERGY PLC Ordinary Shares,Industrial Specialties
ADSEW,ADSEW,ADS-TEC ENERGY PLC Warrant,Industrial Specialties
ADSK,ADSK,Autodesk Inc. Common Stock,Computer Software: Prepackaged Software
ADT,ADT,ADT Inc. Common Stock,Diversified Commercial Services
ADTN,ADTN,ADTRAN Holdings Inc. Common Stock,Telecommunications Equipment
ADTX,ADTX,Aditxt Inc. Common Stock,Biotechnology: Pharmaceutical Preparations
ADUR,ADUR,Aduro Clean Technologies Inc. Common Stock,NA
ADUS,ADUS,Addus HomeCare Corporation Common Stock,Medical/Nursing Services
ADV,ADV,Advantage Solutions Inc. Class A Common Stock,Business Services
ADVM,ADVM,Adverum Biotechnologies Inc. Common Stock,Biotechnology: Biological Products (No Diagnostic Substances)
ADVWW,ADVWW,Advantage Solutions Inc. Warrant,Business Services
ADX,ADX,Adams Diversified Equity Fund Inc.,Investment Managers
ADXN,ADXN,Addex Therapeutics Ltd American Depositary Shares,Biotechnology: Pharmaceutical Preparations
AE,AE,Adams Resources & Energy Inc. Common Stock,Oil Refining/Marketing
AEE,AEE,Ameren Corporation Common Stock,Power Generation
AEF,AEF,abrdn Emerging Markets Equity Income Fund Inc. Common Stock,Finance/Investors Services
AEFC,AEFC,Aegon Funding Company LLC 5.10% Subordinated Notes due 2049,NA
AEG,AEG,Aegon Ltd. New York Registry Shares,Life Insurance
AEHL,AEHL,Antelope Enterprise Holdings Limited Class A Ordinary Shares,Building Materials
AEHR,AEHR,Aehr Test Systems Common Stock,Electrical Products
AEI,AEI,Alset Inc. Common Stock (TX),Real Estate
AEIS,AEIS,Advanced Energy Industries Inc. Common Stock,Industrial Machinery/Components
AEM,AEM,Agnico Eagle Mines Limited Common Stock,Precious Metals
AEMD,AEMD,Aethlon Medical Inc. Common Stock,Medical/Dental Instruments
AENT,AENT,Alliance Entertainment Holding Corporation Class A Common Stock,Durable Goods
AENTW,AENTW,Alliance Entertainment Holding Corporation Warrants,Durable Goods
AEO,AEO,American Eagle Outfitters Inc. Common Stock,Clothing/Shoe/Accessory Stores
AEON,AEON,AEON Biopharma Inc. Class A Common Stock,Biotechnology: Pharmaceutical Preparations
AEP,AEP,American Electric Power Company Inc. Common Stock,Electric Utilities: Central
AER,AER,AerCap Holdings N.V. Ordinary Shares,Diversified Commercial Services
AERT,AERT,Aeries Technology Inc. Class A Ordinary Share,Professional Services
AERTW,AERTW,Aeries Technology Inc. Warrant,Professional Services
AES,AES,The AES Corporation Common Stock,Electric Utilities: Central
AESI,AESI,Atlas Energy Solutions Inc. Common Stock,Mining & Quarrying of Nonmetallic Minerals (No Fuels)
AEVA,AEVA,Aeva Technologies Inc. Common Stock,Auto Parts:O.E.M.
AEYE,AEYE,AudioEye Inc. Common Stock,Computer Software: Prepackaged Software
AFB,AFB,AllianceBernstein National Municipal Income Fund Inc,Trusts Except Educational Religious and Charitable
AFBI,AFBI,Affinity Bancshares Inc. Common Stock (MD),Banks
AFCG,AFCG,Advanced Flower Capital Inc. Common Stock,Real Estate
AFG,AFG,American Financial Group Inc. Common Stock,Property-Casualty Insurers
AFGB,AFGB,American Financial Group Inc. 5.875% Subordinated Debentures due 2059,Property-Casualty Insurers
AFGC,AFGC,American Financial Group Inc. 5.125% Subordinated Debentures due 2059,Property-Casualty Insurers
AFGD,AFGD,American Financial Group Inc. 5.625% Subordinated Debentures due 2060,Property-Casualty Insurers
AFGE,AFGE,American Financial Group Inc. 4.500% Subordinated Debentures due 2060,Property-Casualty Insurers
AFJK,AFJK,Aimei Health Technology Co. Ltd Ordinary Share,NA
AFJKU,AFJKU,Aimei Health Technology Co. Ltd Unit,NA
AFL,AFL,AFLAC Incorporated Common Stock,Accident &Health Insurance
AFMD,AFMD,Affimed N.V.,Biotechnology: Pharmaceutical Preparations
AFRI,AFRI,Forafric Global PLC Ordinary Shares,Packaged Foods
AFRIW,AFRIW,Forafric Global PLC Warrants,Packaged Foods
AFRM,AFRM,Affirm Holdings Inc. Class A Common Stock,Finance: Consumer Services
AFYA,AFYA,Afya Limited Class A Common Shares,Other Consumer Services
AG,AG,First Majestic Silver Corp. Ordinary Shares (Canada),Precious Metals
AGAE,AGAE,Allied Gaming & Entertainment Inc. Common Stock,Services-Misc. Amusement & Recreation
AGCO,AGCO,AGCO Corporation Common Stock,Industrial Machinery/Components
AGD,AGD,abrdn Global Dynamic Dividend Fund Common Shares of Beneficial Interest,Trusts Except Educational Religious and Charitable
AGEN,AGEN,Agenus Inc. Common Stock,Biotechnology: Biological Products (No Diagnostic Substances)
AGFY,AGFY,Agrify Corporation Common Stock,Farming/Seeds/Milling
AGI,AGI,Alamos Gold Inc. Class A Common Shares,Precious Metals
AGIO,AGIO,Agios Pharmaceuticals Inc. Common Stock,Biotechnology: Pharmaceutical Preparations
AGL,AGL,agilon health inc. Common Stock,Misc Health and Biotechnology Services
AGM,AGM,Federal Agricultural Mortgage Corporation Common Stock,Finance Companies
AGM^D,AGM^D,Federal Agricultural Mortgage Corporation 5.700% Non-Cumulative Preferred Stock Series D,NA
AGM^E,AGM^E,Federal Agricultural Mortgage Corporation 5.750% Non-Cumulative Preferred Stock Series E,NA
AGM^F,AGM^F,Federal Agricultural Mortgage Corporation 5.250% Non-Cumulative Preferred Stock Series F,NA
AGM^G,AGM^G,Federal Agricultural Mortgage Corporation 4.875% Non-Cumulative Preferred Stock Series G,NA
AGMH,AGMH,AGM Group Holdings Inc. Class A Ordinary Shares,EDP Services
AGNC,AGNC,AGNC Investment Corp. Common Stock,Real Estate Investment Trusts
AGNCL,AGNCL,AGNC Investment Corp. Depositary Shares Each Representing a 1/1000th Interest in a Share of 7.75% Series G Fixed-Rate Reset Cumulative Redeemable Preferred Stock,Real Estate Investment Trusts
AGNCM,AGNCM,AGNC Investment Corp. Depositary Shares rep 6.875% Series D Fixed-to-Floating Cumulative Redeemable Preferred Stock,Real Estate Investment Trusts
AGNCN,AGNCN,AGNC Investment Corp. Depositary Shares Each Representing a 1/1000th Interest in a Share of 7.00% Series C Fixed-To-Floating Rate Cumulative Redeemable Preferred Stock,Real Estate Investment Trusts
AGNCO,AGNCO,AGNC Investment Corp. Depositary Shares each representing a 1/1000th interest in a share of 6.50% Series E Fixed-to-Floating Cumulative Redeemable Preferred Stock,Real Estate Investment Trusts
AGNCP,AGNCP,AGNC Investment Corp. Depositary Shares Each Representing a 1/1000th Interest in a Share of 6.125% Series F Fixed-to-Floating Rate Cumulative Redeemable Preferred Stock,Real Estate Investment Trusts
AGO,AGO,Assured Guaranty Ltd. Common Stock,Property-Casualty Insurers
AGR,AGR,Avangrid Inc. Common Stock,Electric Utilities: Central
AGRI,AGRI,AgriFORCE  Growing Systems Ltd. Common Shares,Metal Fabrications
AGRO,AGRO,Adecoagro S.A. Common Shares,Farming/Seeds/Milling
AGS,AGS,PlayAGS Inc. Common Stock,Miscellaneous manufacturing industries
AGX,AGX,Argan Inc. Common Stock,Engineering & Construction
AGYS,AGYS,Agilysys Inc. Common Stock (DE),EDP Services
AHCO,AHCO,AdaptHealth Corp. Common Stock,Medical/Nursing Services
AHG,AHG,Akso Health Group ADS,Business Services
AHH,AHH,Armada Hoffler Properties Inc. Common Stock,Real Estate
AHH^A,AHH^A,Armada Hoffler Properties Inc. 6.75% Series A Cumulative Redeemable Perpetual Preferred Stock,NA
AHL^C,AHL^C,Aspen Insurance Holdings Limited 5.95% Fixed-to-Floating Rate Perpetual Non-Cumulative Preference Shares,NA
AHL^D,AHL^D,Aspen Insurance Holdings Limited 5.625% Perpetual Non-Cumulative Preference Shares,NA
AHL^E,AHL^E,Aspen Insurance Holdings Limited Depositary Shares each representing a 1/1000th interest in a share of 5.625% Perpetual Non-Cumulative Preference Shares,NA
AHL^F,AHL^F,Aspen Insurance Holdings Limited Depositary Shares each representing a 1/1000th Interest in a 7.00% Perpetual Non-Cumulative Preference Share,NA
AHR,AHR,American Healthcare REIT Inc. Common Stock,Real Estate Investment Trusts
AHT,AHT,Ashford Hospitality Trust Inc Common Stock,Real Estate Investment Trusts
AHT^D,AHT^D,Ashford Hospitality Trust Inc 8.45% Series D Cumulative Preferred Stock,NA
AHT^F,AHT^F,Ashford Hospitality Trust Inc 7.375% Series F Cumulative Preferred Stock,NA
AHT^G,AHT^G,Ashford Hospitality Trust Inc 7.375% Series G Cumulative Preferred Stock,NA
AHT^H,AHT^H,Ashford Hospitality Trust Inc 7.50% Series H Cumulative Preferred Stock,NA
AHT^I,AHT^I,Ashford Hospitality Trust Inc 7.50% Series I Cumulative Preferred Stock,NA
AI,AI,C3.ai Inc. Class A Common Stock,Computer Software: Prepackaged Software
AIEV,AIEV,Thunder Power Holdings Inc. Common Stock,Auto Manufacturing
AIFF,AIFF,Firefly Neuroscience Inc. Common Stock,Computer Software: Prepackaged Software
AIFU,AIFU,AIX Inc. American Depositary Shares,Specialty Insurers
AIG,AIG,American International Group Inc. New Common Stock,Life Insurance
AIHS,AIHS,Senmiao Technology Limited Common Stock,Finance: Consumer Services
AILE,AILE,iLearningEngines Inc. Common Stock,Computer Software: Prepackaged Software
AILEW,AILEW,iLearningEngines Inc. Warrant,Computer Software: Prepackaged Software
AIM,AIM,AIM ImmunoTech Inc. Common Stock,Biotechnology: Biological Products (No Diagnostic Substances)
AIMAU,AIMAU,Aimfinity Investment Corp. I Unit,Blank Checks
AIMAW,AIMAW,Aimfinity Investment Corp. I Warrant,Blank Checks
AIMD,AIMD,Ainos Inc. Common Stock,Biotechnology: Pharmaceutical Preparations
AIMDW,AIMDW,Ainos Inc. Warrants,Biotechnology: Pharmaceutical Preparations
AIN,AIN,Albany International Corporation Common Stock,Textiles
AIO,AIO,Virtus Artificial Intelligence & Technology Opportunities Fund Common Shares of Beneficial Interest,Finance/Investors Services
AIOT,AIOT,PowerFleet Inc. Common Stock,Telecommunications Equipment
AIP,AIP,Arteris Inc. Common Stock,Semiconductors
AIR,AIR,AAR Corp. Common Stock,Aerospace
AIRE,AIRE,reAlpha Tech Corp. Common Stock,Real Estate
AIRG,AIRG,Airgain Inc. Common Stock,Radio And Television Broadcasting And Communications Equipment
AIRI,AIRI,Air Industries Group Common Stock,Military/Government/Technical
AIRJ,AIRJ,AirJoule Technologies Corporation Class A Common Stock,Industrial Machinery/Components
AIRJW,AIRJW,AirJoule Technologies Corporation Warrant,Industrial Machinery/Components
AIRS,AIRS,AirSculpt Technologies Inc. Common Stock,Medical/Nursing Services
AIRT,AIRT,Air T Inc. Common Stock,Air Freight/Delivery Services
AIRTP,AIRTP,Air T Inc. Air T Funding Alpha Income Trust Preferred Securities,Air Freight/Delivery Services
AISP,AISP,Airship AI Holdings Inc. Class A Common Stock,Computer Software: Prepackaged Software
AISPW,AISPW,Airship AI Holdings Inc. Warrants,Computer Software: Prepackaged Software
AIT,AIT,Applied Industrial Technologies Inc. Common Stock,Industrial Specialties
AITR,AITR,AI TRANSPORTATION ACQUISITION CORP Ordinary shares,NA
AITRR,AITRR,AI TRANSPORTATION ACQUISITION CORP Right,NA
AITRU,AITRU,AI TRANSPORTATION ACQUISITION CORP Unit,NA
AIV,AIV,Apartment Investment and Management Company Common Stock,Real Estate Investment Trusts
AIXI,AIXI,XIAO-I Corporation American Depositary Shares,Computer Software: Prepackaged Software
AIZ,AIZ,Assurant Inc. Common Stock,Property-Casualty Insurers
AIZN,AIZN,Assurant Inc. 5.25% Subordinated Notes due 2061,Property-Casualty Insurers
AJG,AJG,Arthur J. Gallagher & Co. Common Stock,Specialty Insurers
AKA,AKA,a.k.a. Brands Holding Corp. Common Stock,Catalog/Specialty Distribution
AKAM,AKAM,Akamai Technologies Inc. Common Stock,Business Services
AKAN,AKAN,Akanda Corp. Common Shares,Medicinal Chemicals and Botanical Products
AKBA,AKBA,Akebia Therapeutics Inc. Common Stock,Biotechnology: Pharmaceutical Preparations
AKO/A,AKO/A,Embotelladora Andina S.A.,NA
AKO/B,AKO/B,Embotelladora Andina S.A.,NA
AKR,AKR,Acadia Realty Trust Common Stock,Real Estate Investment Trusts
AKRO,AKRO,Akero Therapeutics Inc. Common Stock,Biotechnology: Pharmaceutical Preparations
AKTS,AKTS,Akoustis Technologies Inc. Common Stock,Telecommunications Equipment
AKTX,AKTX,Akari Therapeutics plc ADS,Biotechnology: Pharmaceutical Preparations
AKYA,AKYA,Akoya BioSciences Inc. Common Stock,Biotechnology: Laboratory Analytical Instruments
AL,AL,Air Lease Corporation Class A Common Stock,Diversified Commercial Services
ALAB,ALAB,Astera Labs Inc. Common Stock,Semiconductors
ALAR,ALAR,Alarum Technologies Ltd. American Depositary Share,Computer Software: Prepackaged Software
ALB,ALB,Albemarle Corporation Common Stock,Major Chemicals
ALB^A,ALB^A,Albemarle Corporation Depositary Shares each representing a 1/20th of 7.25% Series A Mandatory Convertible Preferred Stock,NA
ALBT,ALBT,Avalon GloboCare Corp. Common Stock,Biotechnology: Biological Products (No Diagnostic Substances)
ALC,ALC,Alcon Inc. Ordinary Shares,Ophthalmic Goods
ALCE,ALCE,Alternus Clean Energy Inc. Class A Common Stock,Power Generation
ALCO,ALCO,Alico Inc. Common Stock,NA
ALCY,ALCY,Alchemy Investments Acquisition Corp 1 Class A Ordinary Shares,Blank Checks
ALCYW,ALCYW,Alchemy Investments Acquisition Corp 1 Warrants,Blank Checks
ALDFU,ALDFU,Aldel Financial II Inc. Units,Blank Checks
ALDX,ALDX,Aldeyra Therapeutics Inc. Common Stock,Biotechnology: Pharmaceutical Preparations
ALE,ALE,Allete Inc.,Power Generation
ALEC,ALEC,Alector Inc. Common Stock,Biotechnology: Biological Products (No Diagnostic Substances)
ALEX,ALEX,Alexander & Baldwin Inc. Common Stock REIT Holding Company,Real Estate Investment Trusts
ALF,ALF,Centurion Acquisition Corp. Class A Ordinary Shares,NA
ALFUU,ALFUU,Centurion Acquisition Corp. Unit,NA
ALFUW,ALFUW,Centurion Acquisition Corp. Warrant,Blank Checks
ALG,ALG,Alamo Group Inc. Common Stock,Industrial Machinery/Components
ALGM,ALGM,Allegro MicroSystems Inc. Common Stock,Semiconductors
ALGN,ALGN,Align Technology Inc. Common Stock,Industrial Specialties
ALGS,ALGS,Aligos Therapeutics Inc. Common Stock,Biotechnology: Biological Products (No Diagnostic Substances)
ALGT,ALGT,Allegiant Travel Company Common Stock,Air Freight/Delivery Services
ALHC,ALHC,Alignment Healthcare Inc. Common Stock,Medical Specialities
ALIT,ALIT,Alight Inc. Class A Common Stock,Business Services
ALK,ALK,Alaska Air Group Inc. Common Stock,Air Freight/Delivery Services
ALKS,ALKS,Alkermes plc Ordinary Shares,Biotechnology: Pharmaceutical Preparations
ALKT,ALKT,Alkami Technology Inc. Common Stock,Computer Software: Prepackaged Software
ALL,ALL,Allstate Corporation (The) Common Stock,Property-Casualty Insurers
ALL^B,ALL^B,Allstate Corporation (The) 5.100% Fixed-to-Floating Rate Subordinated Debentures due 2053,NA
ALL^H,ALL^H,Allstate Corporation (The) Depositary Shares each representing a 1/1000th interest in a share of Fixed Rate Noncumulative Perpetual Preferred Stock Series H,NA
ALL^I,ALL^I,Allstate Corporation (The) Depositary Shares each representing a 1/1000th interest in a share of Fixed Rate Noncumulative Perpetual Preferred Stock Series I,NA
ALL^J,ALL^J,Allstate Corporation (The) Depositary Shares each representing a 1/1000th interest in a share of Fixed Rate Noncumulative Perpetual Preferred Stock Series J,NA
ALLE,ALLE,Allegion plc Ordinary Shares,Diversified Commercial Services
ALLK,ALLK,Allakos Inc. Common Stock,Biotechnology: Pharmaceutical Preparations
ALLO,ALLO,Allogene Therapeutics Inc. Common Stock,Biotechnology: Biological Products (No Diagnostic Substances)
ALLR,ALLR,Allarity Therapeutics Inc. Common Stock,Biotechnology: Pharmaceutical Preparations
ALLT,ALLT,Allot Ltd. Ordinary Shares,Computer Communications Equipment
ALLY,ALLY,Ally Financial Inc. Common Stock,Major Banks
ALMS,ALMS,Alumis Inc. Common Stock,Biotechnology: Pharmaceutical Preparations
ALNT,ALNT,Allient Inc. Common Stock,Electrical Products
ALNY,ALNY,Alnylam Pharmaceuticals Inc. Common Stock,Biotechnology: Pharmaceutical Preparations
ALOT,ALOT,AstroNova Inc. Common Stock,Computer peripheral equipment
ALRM,ALRM,Alarm.com Holdings Inc. Common Stock,Computer Software: Prepackaged Software
ALRN,ALRN,Aileron Therapeutics Inc. Common Stock,Biotechnology: Pharmaceutical Preparations
ALRS,ALRS,Alerus Financial Corporation Common Stock,Major Banks
ALSA,ALSA,Alpha Star Acquisition Corporation Ordinary Shares,Blank Checks
ALSAU,ALSAU,Alpha Star Acquisition Corporation Units,Blank Checks
ALSAW,ALSAW,Alpha Star Acquisition Corporation Warrants,Blank Checks
ALSN,ALSN,Allison Transmission Holdings Inc. Common Stock,Auto Parts:O.E.M.
ALT,ALT,Altimmune Inc. Common Stock,Biotechnology: Pharmaceutical Preparations
ALTG,ALTG,Alta Equipment Group Inc. Class A Common Stock,Industrial Machinery/Components
ALTG^A,ALTG^A,Alta Equipment Group Inc. Depositary Shares (each representing 1/1000th in a share of 10% Series A Cumulative Perpetual Preferred Stock),NA
ALTI,ALTI,AlTi Global Inc. Class A Common Stock,Investment Managers
ALTM,ALTM,Arcadium Lithium plc Ordinary Shares,Major Chemicals
ALTO,ALTO,Alto Ingredients Inc. Common Stock,Major Chemicals
ALTR,ALTR,Altair Engineering Inc. Class A Common Stock,Computer Software: Prepackaged Software
ALTS,ALTS,ALT5 Sigma Corporation Common Stock,Home Furnishings
ALUR,ALUR,Allurion Technologies Inc. Common Stock,Medical/Dental Instruments
ALV,ALV,Autoliv Inc. Common Stock,Auto Parts:O.E.M.
ALVO,ALVO,Alvotech Ordinary Shares,Biotechnology: Biological Products (No Diagnostic Substances)
ALVOW,ALVOW,Alvotech Warrant,Biotechnology: Biological Products (No Diagnostic Substances)
