code,tickers,name,industry
CRDL,CRDL,Cardiol Therapeutics Inc. Class A Common Shares,Biotechnology: Biological Products (No Diagnostic Substances)
CRDO,CRDO,Credo Technology Group Holding Ltd Ordinary Shares,Semiconductors
CREG,CREG,Smart Powerr Corp. Common Stock,Business Services
CRESW,CRESW,Cresud S.A.C.I.F. y A. Warrant,Real Estate
CRESY,CRESY,Cresud S.A.C.I.F. y A. American Depositary Shares,Real Estate
CREV,CREV,Carbon Revolution Public Limited Ordinary Shares,Auto Parts:O.E.M.
CREVW,CREVW,Carbon Revolution Public Limited Company Warrant,Auto Parts:O.E.M.
CREX,CREX,Creative Realities Inc. Common Stock,EDP Services
CRF,CRF,Cornerstone Total Return Fund Inc. (The) Common Stock,Finance/Investors Services
CRGO,CRGO,Freightos Limited Ordinary shares,Oil Refining/Marketing
CRGOW,CRGOW,Freightos Limited Warrants,Oil Refining/Marketing
CRGX,CRGX,CARGO Therapeutics Inc. Common Stock,NA
CRGY,CRGY,Crescent Energy Company Class A Common Stock,Oil & Gas Production
CRH,CRH,CRH PLC Ordinary Shares,Building Materials
CRI,CRI,Carter's Inc. Common Stock,Apparel
CRIS,CRIS,Curis Inc. Common Stock,Biotechnology: Biological Products (No Diagnostic Substances)
CRK,CRK,Comstock Resources Inc. Common Stock,Oil & Gas Production
CRKN,CRKN,Crown Electrokinetics Corp. Common Stock,Industrial Machinery/Components
CRL,CRL,Charles River Laboratories International Inc. Common Stock,Biotechnology: Commercial Physical & Biological Resarch
CRM,CRM,Salesforce Inc. Common Stock,Computer Software: Prepackaged Software
CRMD,CRMD,CorMedix Inc. Common Stock,Biotechnology: Pharmaceutical Preparations
CRML,CRML,Critical Metals Corp. Ordinary Shares,Metal Mining
CRMLW,CRMLW,Critical Metals Corp. Warrants,Metal Mining
CRMT,CRMT,America's Car-Mart Inc Common Stock,Retail-Auto Dealers and Gas Stations
CRNC,CRNC,Cerence Inc. Common Stock,Computer Software: Prepackaged Software
CRNT,CRNT,Ceragon Networks Ltd. Ordinary Shares,Radio And Television Broadcasting And Communications Equipment
CRNX,CRNX,Crinetics Pharmaceuticals Inc. Common Stock,Biotechnology: Pharmaceutical Preparations
CRON,CRON,Cronos Group Inc. Common Share,Medicinal Chemicals and Botanical Products
CROX,CROX,Crocs Inc. Common Stock,Shoe Manufacturing
CRS,CRS,Carpenter Technology Corporation Common Stock,Steel/Iron Ore
CRSP,CRSP,CRISPR Therapeutics AG Common Shares,Biotechnology: Biological Products (No Diagnostic Substances)
CRSR,CRSR,Corsair Gaming Inc. Common Stock,Computer peripheral equipment
CRT,CRT,Cross Timbers Royalty Trust Common Stock,Oil & Gas Production
CRTO,CRTO,Criteo S.A. American Depositary Shares,Advertising
CRUS,CRUS,Cirrus Logic Inc. Common Stock,Semiconductors
CRVL,CRVL,CorVel Corp. Common Stock,Specialty Insurers
CRVO,CRVO,CervoMed Inc. Common Stock,Biotechnology: Pharmaceutical Preparations
CRVS,CRVS,Corvus Pharmaceuticals Inc. Common Stock,Biotechnology: Pharmaceutical Preparations
CRWD,CRWD,CrowdStrike Holdings Inc. Class A Common Stock,Computer Software: Prepackaged Software
CRWS,CRWS,Crown Crafts Inc Common Stock,Textiles
CSAN,CSAN,Cosan S.A. ADS,Retail-Auto Dealers and Gas Stations
CSBR,CSBR,Champions Oncology Inc. Common Stock,Biotechnology: Biological Products (No Diagnostic Substances)
CSCI,CSCI,COSCIENS Biopharma Inc. Common Stock,Biotechnology: Pharmaceutical Preparations
CSCO,CSCO,Cisco Systems Inc. Common Stock (DE),Computer Communications Equipment
CSGP,CSGP,CoStar Group Inc. Common Stock,Business Services
CSGS,CSGS,CSG Systems International Inc. Common Stock,EDP Services
CSIQ,CSIQ,Canadian Solar Inc. Common Shares (ON),Semiconductors
CSL,CSL,Carlisle Companies Incorporated Common Stock,Specialty Chemicals
CSLM,CSLM,CSLM Acquisition Corp. Class A Ordinary Share,Blank Checks
CSLMR,CSLMR,CSLM Acquisition Corp. Right,Blank Checks
CSLMW,CSLMW,CSLM Acquisition Corp. Warrant,Blank Checks
CSLR,CSLR,Complete Solaria Inc. Common Stock,Semiconductors
CSLRW,CSLRW,Complete Solaria Inc. Warrants,Semiconductors
CSPI,CSPI,CSP Inc. Common Stock,EDP Services
CSQ,CSQ,Calamos Strategic Total Return Common Stock,Finance Companies
CSR,CSR,D/B/A Centerspace Common Stock,Real Estate Investment Trusts
CSTE,CSTE,Caesarstone Ltd. Ordinary Shares,Building Materials
CSTL,CSTL,Castle Biosciences Inc. Common Stock,Medical Specialities
CSTM,CSTM,Constellium SE Ordinary Shares (France),Metal Fabrications
CSV,CSV,Carriage Services Inc. Common Stock,Other Consumer Services
CSWC,CSWC,Capital Southwest Corporation Common Stock,Textiles
CSWCZ,CSWCZ,Capital Southwest Corporation 7.75% Notes due 2028,Finance Companies
CSWI,CSWI,CSW Industrials Inc. Common Stock,Home Furnishings
CSX,CSX,CSX Corporation Common Stock,Railroads
CTA^A,CTA^A,EIDP Inc. Preferred Stock $3.50 Series,NA
CTA^B,CTA^B,EIDP Inc. Preferred Stock $4.50 Series,NA
CTAS,CTAS,Cintas Corporation Common Stock,Apparel
CTBB,CTBB,Qwest Corporation 6.5% Notes due 2056,Telecommunications Equipment
CTBI,CTBI,Community Trust Bancorp Inc. Common Stock,Major Banks
CTCX,CTCX,Carmell Corporation Common Stock,Medical/Dental Instruments
CTCXW,CTCXW,Carmell Corporation Warrant,Medical/Dental Instruments
CTDD,CTDD,Qwest Corporation 6.75% Notes due 2057,Telecommunications Equipment
CTGO,CTGO,Contango ORE Inc. Common Stock,Precious Metals
CTHR,CTHR,Charles & Colvard Ltd Common Stock,Consumer Specialties
CTKB,CTKB,Cytek Biosciences Inc. Common Stock,Biotechnology: Laboratory Analytical Instruments
CTLP,CTLP,Cantaloupe Inc. Common Stock,Office Equipment/Supplies/Services
CTLT,CTLT,Catalent Inc. Common Stock,Biotechnology: Pharmaceutical Preparations
CTM,CTM,Castellum Inc. Common Stock,Professional Services
CTMX,CTMX,CytomX Therapeutics Inc. Common Stock,Biotechnology: Pharmaceutical Preparations
CTNM,CTNM,Contineum Therapeutics Inc. Class A Common Stock,Biotechnology: Pharmaceutical Preparations
CTNT,CTNT,Cheetah Net Supply Chain Service Inc. Class A Common Stock,Motor Vehicles
CTO,CTO,CTO Realty Growth Inc. Common Stock,Real Estate Investment Trusts
CTO^A,CTO^A,CTO Realty Growth Inc. 6.375% Series A Cumulative Redeemable Preferred Stock,NA
CTOR,CTOR,Citius Oncology Inc. Common Stock,Biotechnology: Pharmaceutical Preparations
CTOS,CTOS,Custom Truck One Source Inc. Common Stock,Diversified Commercial Services
CTRA,CTRA,Coterra Energy Inc. Common Stock,Oil & Gas Production
CTRE,CTRE,CareTrust REIT Inc. Common Stock,Real Estate Investment Trusts
CTRI,CTRI,Centuri Holdings Inc. Common Stock,Oil & Gas Production
CTRM,CTRM,Castor Maritime Inc. Common Shares,Marine Transportation
CTRN,CTRN,Citi Trends Inc. Common Stock,Clothing/Shoe/Accessory Stores
CTS,CTS,CTS Corporation Common Stock,Electrical Products
CTSH,CTSH,Cognizant Technology Solutions Corporation Class A Common Stock,EDP Services
CTSO,CTSO,Cytosorbents Corporation Common Stock,Medical/Dental Instruments
CTV,CTV,Innovid Corp. Common Stock,Computer Software: Prepackaged Software
CTVA,CTVA,Corteva Inc. Common Stock,Farming/Seeds/Milling
CTXR,CTXR,Citius Pharmaceuticals Inc. Common Stock,Biotechnology: Pharmaceutical Preparations
CUB,CUB,Lionheart Holdings Class A Ordinary Shares,Industrial Machinery/Components
CUBA,CUBA,Herzfeld Caribbean Basin Fund Inc. (The) Common Stock,Investment Managers
CUBB,CUBB,Customers Bancorp Inc 5.375% Subordinated Notes Due 2034,Major Banks
CUBE,CUBE,CubeSmart Common Shares,Real Estate Investment Trusts
CUBI,CUBI,Customers Bancorp Inc Common Stock,Major Banks
CUBI^E,CUBI^E,Customers Bancorp Inc Fixed-to-Floating Rate Non-Cumulative Perpetual Preferred Stock Series E,NA
CUBI^F,CUBI^F,Customers Bancorp Inc Fixed-to-Floating Rate Non-Cumulative Perpetual Preferred Stock Series F,NA
CUBWU,CUBWU,Lionheart Holdings Unit,Blank Checks
CUBWW,CUBWW,Lionheart Holdings Warrant,NA
CUE,CUE,Cue Biopharma Inc. Common Stock,Biotechnology: Pharmaceutical Preparations
CUK,CUK,Carnival Plc ADS ADS,Marine Transportation
CULP,CULP,Culp Inc. Common Stock,Textiles
CURB,CURB,Curbline Properties Corp. Common Stock,Real Estate
CURI,CURI,CuriosityStream Inc. Class A Common Stock,Movies/Entertainment
CURIW,CURIW,CuriosityStream Inc. Warrant,Movies/Entertainment
CURR,CURR,Currenc Group Inc. Ordinary Shares,Business Services
CURV,CURV,Torrid Holdings Inc. Common Stock,Clothing/Shoe/Accessory Stores
CUTR,CUTR,Cutera Inc. Common Stock,Biotechnology: Electromedical & Electrotherapeutic Apparatus
CUZ,CUZ,Cousins Properties Incorporated Common Stock,Real Estate Investment Trusts
CVAC,CVAC,CureVac N.V. Ordinary Shares,Biotechnology: Pharmaceutical Preparations
CVBF,CVBF,CVB Financial Corporation Common Stock,Major Banks
CVCO,CVCO,Cavco Industries Inc. Common Stock When Issued,Homebuilding
CVE,CVE,Cenovus Energy Inc Common Stock,Oil & Gas Production
CVEO,CVEO,Civeo Corporation (Canada) Common Shares,Hotels/Resorts
CVGI,CVGI,Commercial Vehicle Group Inc. Common Stock,Auto Parts:O.E.M.
CVGW,CVGW,Calavo Growers Inc. Common Stock,Specialty Foods
CVI,CVI,CVR Energy Inc. Common Stock,Integrated oil Companies
CVKD,CVKD,Cadrenal Therapeutics Inc. Common Stock,Biotechnology: Pharmaceutical Preparations
CVLG,CVLG,Covenant Logistics Group Inc. Class A Common Stock,Trucking Freight/Courier Services
CVLT,CVLT,Commvault Systems Inc. Common Stock,Computer Software: Prepackaged Software
CVM,CVM,Cel-Sci Corporation Common Stock,Biotechnology: Biological Products (No Diagnostic Substances)
CVNA,CVNA,Carvana Co. Class A Common Stock,Retail-Auto Dealers and Gas Stations
CVR,CVR,Chicago Rivet & Machine Co. Common Stock,Industrial Machinery/Components
CVRX,CVRX,CVRx Inc. Common Stock,Medical/Dental Instruments
CVS,CVS,CVS Health Corporation Common Stock,Retail-Drug Stores and Proprietary Stores
CVU,CVU,CPI Aerostructures Inc. Common Stock,Military/Government/Technical
CVV,CVV,CVD Equipment Corporation Common Stock,Industrial Machinery/Components
CVX,CVX,Chevron Corporation Common Stock,Integrated oil Companies
CW,CW,Curtiss-Wright Corporation Common Stock,Industrial Machinery/Components
CWAN,CWAN,Clearwater Analytics Holdings Inc. Class A Common Stock,Computer Software: Prepackaged Software
CWBC,CWBC,Community West Bancshares Common Stock,Major Banks
CWCO,CWCO,Consolidated Water Co. Ltd. Ordinary Shares,Water Supply
CWD,CWD,CaliberCos Inc. Class A Common Stock,Real Estate
CWEN,CWEN,Clearway Energy Inc. Class C Common Stock,Electric Utilities: Central
CWH,CWH,Camping World Holdings Inc. Class A Common Stock,Retail-Auto Dealers and Gas Stations
CWK,CWK,Cushman & Wakefield plc Ordinary Shares,Real Estate
CWST,CWST,Casella Waste Systems Inc. Class A Common Stock,Environmental Services
CWT,CWT,California Water Service Group Common Stock,Water Supply
CX,CX,Cemex S.A.B. de C.V. Sponsored ADR,Building Materials
CXAI,CXAI,CXApp Inc. Class A Common Stock,EDP Services
CXAIW,CXAIW,CXApp Inc. Warrant,EDP Services
CXDO,CXDO,Crexendo Inc. Common Stock,Telecommunications Equipment
CXE,CXE,MFS High Income Municipal Trust Common Stock,Investment Managers
CXH,CXH,MFS Investment Grade Municipal Trust Common Stock,Investment Managers
CXM,CXM,Sprinklr Inc. Class A Common Stock,Computer Software: Prepackaged Software
CXT,CXT,Crane NXT Co. Common Stock,Metal Fabrications
CXW,CXW,CoreCivic Inc. Common Stock,Real Estate Investment Trusts
CYBN,CYBN,Cybin Inc. Common Shares,Biotechnology: Pharmaceutical Preparations
CYBR,CYBR,CyberArk Software Ltd. Ordinary Shares,Computer Software: Prepackaged Software
CYCC,CYCC,Cyclacel Pharmaceuticals Inc. Common Stock,Biotechnology: Pharmaceutical Preparations
CYCCP,CYCCP,Cyclacel Pharmaceuticals Inc. 6% Convertible Preferred Stock,Biotechnology: Pharmaceutical Preparations
CYCN,CYCN,Cyclerion Therapeutics Inc. Common Stock,Biotechnology: Pharmaceutical Preparations
CYD,CYD,China Yuchai International Limited Common Stock,Industrial Machinery/Components
CYH,CYH,Community Health Systems Inc. Common Stock,Hospital/Nursing Management
CYN,CYN,Cyngn Inc. Common Stock,EDP Services
CYRX,CYRX,CryoPort Inc. Common Stock,Biotechnology: Pharmaceutical Preparations
CYTH,CYTH,Cyclo Therapeutics Inc. Common Stock,Biotechnology: Biological Products (No Diagnostic Substances)
CYTHW,CYTHW,Cyclo Therapeutics Inc. Warrant,Biotechnology: Biological Products (No Diagnostic Substances)
CYTK,CYTK,Cytokinetics Incorporated Common Stock,Biotechnology: Pharmaceutical Preparations
CYTO,CYTO,Altamira Therapeutics Ltd. Common Shares,Biotechnology: Pharmaceutical Preparations
CZFS,CZFS,Citizens Financial Services Inc. Common Stock,Major Banks
CZNC,CZNC,Citizens & Northern Corp Common Stock,Major Banks
CZR,CZR,Caesars Entertainment Inc. Common Stock,Hotels/Resorts
CZWI,CZWI,Citizens Community Bancorp Inc. Common Stock,Savings Institutions
D,D,Dominion Energy Inc. Common Stock,Electric Utilities: Central
DAC,DAC,Danaos Corporation Common Stock,Marine Transportation
DADA,DADA,Dada Nexus Limited American Depositary Shares,Computer Software: Programming Data Processing
DAIO,DAIO,Data I/O Corporation Common Stock,Electrical Products
DAKT,DAKT,Daktronics Inc. Common Stock,Miscellaneous manufacturing industries
DAL,DAL,Delta Air Lines Inc. Common Stock,Air Freight/Delivery Services
DALN,DALN,DallasNews Corporation Series A Common Stock,Newspapers/Magazines
DAN,DAN,Dana Incorporated Common Stock,Auto Parts:O.E.M.
DAO,DAO,Youdao Inc. American Depositary Shares each representing one Class A Ordinary Share,Other Consumer Services
DAR,DAR,Darling Ingredients Inc. Common Stock,Packaged Foods
DARE,DARE,Dare Bioscience Inc. Common Stock,Biotechnology: Pharmaceutical Preparations
DASH,DASH,DoorDash Inc. Class A Common Stock,Business Services
DATS,DATS,DatChat Inc. Common Stock,Telecommunications Equipment
DATSW,DATSW,DatChat Inc. Series A Warrant,Telecommunications Equipment
DAVA,DAVA,Endava plc American Depositary Shares (each representing one Class A Ordinary Share),EDP Services
DAVE,DAVE,Dave Inc. Class A Common Stock,Finance: Consumer Services
DAVEW,DAVEW,Dave Inc. Warrants,Finance: Consumer Services
DAWN,DAWN,Day One Biopharmaceuticals Inc. Common Stock,Biotechnology: Pharmaceutical Preparations
DAY,DAY,Dayforce Inc. Common Stock,Computer Software: Prepackaged Software
DB,DB,Deutsche Bank AG Common Stock,Major Banks
DBD,DBD,Diebold Nixdorf Incorporated Common stock,Office Equipment/Supplies/Services
DBGI,DBGI,Digital Brands Group Inc. Common Stock,Clothing/Shoe/Accessory Stores
DBGIW,DBGIW,Digital Brands Group Inc. Warrant,Clothing/Shoe/Accessory Stores
DBI,DBI,Designer Brands Inc. Class A Common Stock,Clothing/Shoe/Accessory Stores
DBL,DBL,DoubleLine Opportunistic Credit Fund Common Shares of Beneficial Interest,NA
DBRG,DBRG,DigitalBridge Group Inc.,Real Estate Investment Trusts
DBRG^H,DBRG^H,DigitalBridge Group Inc. 7.125% Series H,NA
DBRG^I,DBRG^I,DigitalBridge Group Inc. 7.15% Series I,NA
DBRG^J,DBRG^J,DigitalBridge Group Inc. 7.125% Series J,NA
DBVT,DBVT,DBV Technologies S.A. American Depositary Shares,Biotechnology: Biological Products (No Diagnostic Substances)
DBX,DBX,Dropbox Inc. Class A Common Stock,Computer Software: Prepackaged Software
DC,DC,Dakota Gold Corp. Common Stock,Metal Mining
DCBO,DCBO,Docebo Inc. Common Shares,Computer Software: Prepackaged Software
DCGO,DCGO,DocGo Inc. Common Stock,Medical/Nursing Services
DCI,DCI,Donaldson Company Inc. Common Stock,Pollution Control Equipment
DCO,DCO,Ducommun Incorporated Common Stock,Military/Government/Technical
DCOM,DCOM,Dime Community Bancshares Inc. Common Stock,Major Banks
DCOMG,DCOMG,Dime Community Bancshares Inc. 9.000% Fixed-to-Floating Rate Subordinated Notes due 2034,Major Banks
DCOMP,DCOMP,Dime Community Bancshares Inc. Fixed-Rate Non-Cumulative Perpetual Preferred Stock Series A,Major Banks
DCTH,DCTH,Delcath Systems Inc. Common Stock,Medical/Dental Instruments
DD,DD,DuPont de Nemours Inc. Common Stock,Major Chemicals
DDC,DDC,DDC Enterprise Limited Class A Ordinary Shares,Packaged Foods
DDD,DDD,3D Systems Corporation Common Stock,Computer Software: Prepackaged Software
DDI,DDI,DoubleDown Interactive Co. Ltd. American Depository Shares,EDP Services
DDL,DDL,Dingdong (Cayman) Limited American Depositary Shares (each two representing three Ordinary Shares),Catalog/Specialty Distribution
DDOG,DDOG,Datadog Inc. Class A Common Stock,Computer Software: Prepackaged Software
DDS,DDS,Dillard's Inc. Common Stock,Department/Specialty Retail Stores
DDT,DDT,Dillard's Capital Trust I,Department/Specialty Retail Stores
DE,DE,Deere & Company Common Stock,Industrial Machinery/Components
DEA,DEA,Easterly Government Properties Inc. Common Stock,Real Estate Investment Trusts
DEC,DEC,Diversified Energy Company plc Ordinary Shares,NA
DECA,DECA,Denali Capital Acquisition Corp. Class A Ordinary Shares,Blank Checks
DECAW,DECAW,Denali Capital Acquisition Corp. Warrant,Blank Checks
DECK,DECK,Deckers Outdoor Corporation Common Stock,Shoe Manufacturing
DEI,DEI,Douglas Emmett Inc. Common Stock,Real Estate Investment Trusts
DELL,DELL,Dell Technologies Inc. Class C Common Stock,Computer Manufacturing
DENN,DENN,Denny's Corporation Common Stock,Restaurants
DEO,DEO,Diageo plc Common Stock,Beverages (Production/Distribution)
DERM,DERM,Journey Medical Corporation Common Stock,Biotechnology: Pharmaceutical Preparations
DESP,DESP,Despegar.com Corp. Ordinary Shares,Transportation Services
DEVS,DEVS,DevvStream Corp. Common Stock,Finance/Investors Services
DFH,DFH,Dream Finders Homes Inc. Class A Common Stock,Homebuilding
DFIN,DFIN,Donnelley Financial Solutions Inc. Common Stock,Other Consumer Services
DFLI,DFLI,Dragonfly Energy Holdings Corp. Common Stock (NV),Industrial Machinery/Components
DFLIW,DFLIW,Dragonfly Energy Holdings Corp. Warrant,Industrial Machinery/Components
DFP,DFP,Flaherty & Crumrine Dynamic Preferred and Income Fund Inc. Common Stock,Investment Managers
DFS,DFS,Discover Financial Services Common Stock,Finance: Consumer Services
DG,DG,Dollar General Corporation Common Stock,Department/Specialty Retail Stores
DGHI,DGHI,Digihost Technology Inc. Common Subordinate Voting Shares,Finance: Consumer Services
DGICA,DGICA,Donegal Group Inc. Class A Common Stock,Property-Casualty Insurers
DGICB,DGICB,Donegal Group Inc. Class B Common Stock,Property-Casualty Insurers
DGII,DGII,Digi International Inc. Common Stock,Computer Communications Equipment
DGLY,DGLY,Digital Ally Inc. Common Stock,Radio And Television Broadcasting And Communications Equipment
DGX,DGX,Quest Diagnostics Incorporated Common Stock,Medical Specialities
DH,DH,Definitive Healthcare Corp. Class A Common Stock,Computer Software: Prepackaged Software
DHAI,DHAI,DIH Holdings US Inc. Class A Common Stock,Medical/Dental Instruments
DHAIW,DHAIW,DIH Holding US Inc. Warrants,Medical/Dental Instruments
DHC,DHC,Diversified Healthcare Trust Common Shares of Beneficial Interest,Real Estate Investment Trusts
DHCNI,DHCNI,Diversified Healthcare Trust 5.625% Senior Notes due 2042,Real Estate Investment Trusts
DHCNL,DHCNL,Diversified Healthcare Trust 6.25% Senior Notes Due 2046,Real Estate Investment Trusts
DHF,DHF,BNY Mellon High Yield Strategies Fund Common Stock,Finance Companies
DHI,DHI,D.R. Horton Inc. Common Stock,Homebuilding
DHIL,DHIL,Diamond Hill Investment Group Inc. Class A Common Stock,Investment Managers
DHR,DHR,Danaher Corporation Common Stock,Industrial Machinery/Components
DHT,DHT,DHT Holdings Inc.,Marine Transportation
DHX,DHX,DHI Group Inc. Common Stock,Business Services
DHY,DHY,Credit Suisse High Yield Bond Fund Common Stock,Finance/Investors Services
DIAX,DIAX,Nuveen Dow 30SM Dynamic Overwrite Fund Common Shares of Beneficial Interest,Finance Companies
DIBS,DIBS,1stdibs.com Inc. Common Stock,Catalog/Specialty Distribution
DIN,DIN,Dine Brands Global Inc. Common Stock,Restaurants
DINO,DINO,HF Sinclair Corporation Common Stock,Natural Gas Distribution
DIOD,DIOD,Diodes Incorporated Common Stock,Semiconductors
DIS,DIS,Walt Disney Company (The) Common Stock,Services-Misc. Amusement & Recreation
DIST,DIST,Distoken Acquisition Corporation Ordinary Shares,Blank Checks
DISTR,DISTR,Distoken Acquisition Corporation Right,Blank Checks
DISTW,DISTW,Distoken Acquisition Corporation Warrant,Blank Checks
DIT,DIT,AMCON Distributing Company Common Stock,Food Distributors
DJCO,DJCO,Daily Journal Corp. (S.C.) Common Stock,Newspapers/Magazines
DJT,DJT,Trump Media & Technology Group Corp. Common Stock,Computer Software: Programming Data Processing
DJTWW,DJTWW,Trump Media & Technology Group Corp. Warrants,Computer Software: Programming Data Processing
DK,DK,Delek US Holdings Inc. Common Stock,Integrated oil Companies
DKL,DKL,Delek Logistics Partners L.P. Common Units representing Limited Partner Interests,Natural Gas Distribution
DKNG,DKNG,DraftKings Inc. Class A Common Stock,Services-Misc. Amusement & Recreation
DKS,DKS,Dick's Sporting Goods Inc Common Stock,Other Specialty Stores
DLB,DLB,Dolby Laboratories Common Stock,Multi-Sector Companies
DLHC,DLHC,DLH Holdings Corp.,Professional Services
DLNG,DLNG,Dynagas LNG Partners LP Common Units,Marine Transportation
DLNG^A,DLNG^A,Dynagas LNG Partners LP 9.00% Series A Cumulative Redeemable Preferred Units,NA
DLNG^B,DLNG^B,Dynagas LNG Partners LP 8.75% Series B Fixed to Floating Rate Cumulative Redeemable Perpetual Preferred Units liquidation preference $25.00 per Uni,NA
DLO,DLO,DLocal Limited Class A Common Shares,Business Services
DLPN,DLPN,Dolphin Entertainment Inc. Common Stock,Other Consumer Services
DLR,DLR,Digital Realty Trust Inc. Common Stock,Real Estate Investment Trusts
DLR^J,DLR^J,Digital Realty Trust Inc. 5.250% Series J Cumulative Redeemable Preferred Stock,NA
DLR^K,DLR^K,Digital Realty Trust Inc. 5.850% Series K Cumulative Redeemable Preferred Stock par value $0.01 per share,NA
DLR^L,DLR^L,Digital Realty Trust Inc. 5.200% Series L Cumulative Redeemable Preferred Stock,NA
DLTH,DLTH,Duluth Holdings Inc. Class B Common Stock,Clothing/Shoe/Accessory Stores
DLTR,DLTR,Dollar Tree Inc. Common Stock,Department/Specialty Retail Stores
DLX,DLX,Deluxe Corporation Common Stock,Publishing
DLY,DLY,DoubleLine Yield Opportunities Fund Common Shares of Beneficial Interest,Investment Managers
DM,DM,Desktop Metal Inc. Class A Common Stock,Industrial Machinery/Components
DMA,DMA,Destra Multi-Alternative Fund Common Stock,Trusts Except Educational Religious and Charitable
DMAC,DMAC,DiaMedica Therapeutics Inc. Common Stock,Biotechnology: Pharmaceutical Preparations
DMB,DMB,BNY Mellon Municipal Bond Infrastructure Fund Inc. Common Stock,Trusts Except Educational Religious and Charitable
DMF,DMF,BNY Mellon Municipal Income Inc. Common Stock,Finance/Investors Services
DMLP,DMLP,Dorchester Minerals L.P. Common Units Representing Limited Partnership Interests,Oil & Gas Production
DMN,DMN,Damon Inc. Common Stock,EDP Services
DMO,DMO,Western Asset Mortgage Opportunity Fund Inc. Common Stock,Trusts Except Educational Religious and Charitable
DMRC,DMRC,Digimarc Corporation Common Stock,EDP Services
DMYY,DMYY,dMY Squared Technology Group Inc. Class A Common Stock,Blank Checks
DNA,DNA,Ginkgo Bioworks Holdings Inc. Class A Common Stock,Biotechnology: Biological Products (No Diagnostic Substances)
DNB,DNB,Dun & Bradstreet Holdings Inc. Common Stock,Finance: Consumer Services
DNLI,DNLI,Denali Therapeutics Inc. Common Stock,Biotechnology: Biological Products (No Diagnostic Substances)
DNMR,DNMR,Danimer Scientific Inc. Common Stock,Major Chemicals
DNN,DNN,Denison Mines Corp Ordinary Shares (Canada),Other Metals and Minerals
DNOW,DNOW,DNOW Inc. Common Stock,Metal Fabrications
DNP,DNP,DNP Select Income Fund Inc. Common Stock,Investment Managers
DNTH,DNTH,Dianthus Therapeutics Inc. Common Stock,Biotechnology: Pharmaceutical Preparations
DNUT,DNUT,Krispy Kreme Inc. Common Stock,Food Chains
DOC,DOC,Healthpeak Properties Inc. Common Stock,Real Estate Investment Trusts
DOCN,DOCN,DigitalOcean Holdings Inc. Common Stock,Computer Software: Programming Data Processing
DOCS,DOCS,Doximity Inc. Class A Common Stock,EDP Services
DOCU,DOCU,DocuSign Inc. Common Stock,Computer Software: Prepackaged Software
DOGZ,DOGZ,Dogness (International) Corporation Class A Common Stock,Miscellaneous manufacturing industries
DOLE,DOLE,Dole plc Ordinary Shares,Farming/Seeds/Milling
DOMH,DOMH,Dominari Holdings Inc. Common Stock,Biotechnology: Pharmaceutical Preparations
DOMO,DOMO,Domo Inc. Class B Common Stock,Computer Software: Prepackaged Software
DOOO,DOOO,BRP Inc. (Recreational Products) Common Subordinate Voting Shares,Industrial Specialties
DORM,DORM,Dorman Products Inc. Common Stock,Auto Parts:O.E.M.
DOUG,DOUG,Douglas Elliman Inc. Common Stock,Real Estate
DOV,DOV,Dover Corporation Common Stock,Industrial Machinery/Components
DOW,DOW,Dow Inc. Common Stock,Major Chemicals
DOX,DOX,Amdocs Limited Ordinary Shares,EDP Services
DOYU,DOYU,DouYu International Holdings Limited ADS,Computer Software: Programming Data Processing
DPG,DPG,Duff & Phelps Utility and Infrastructure Fund Inc.,Trusts Except Educational Religious and Charitable
DPRO,DPRO,Draganfly Inc. Common Shares,Aerospace
DPZ,DPZ,Domino's Pizza Inc Common Stock,Food Distributors
DQ,DQ,DAQO New Energy Corp. American Depositary Shares each representing five ordinary shares,Semiconductors
DRCT,DRCT,Direct Digital Holdings Inc. Class A Common Stock,Advertising
DRD,DRD,DRDGOLD Limited American Depositary Shares,Precious Metals
DRH,DRH,Diamondrock Hospitality Company Common Stock,Real Estate Investment Trusts
DRH^A,DRH^A,Diamondrock Hospitality Company 8.250% Series A Cumulative Redeemable Preferred Stock,NA
DRI,DRI,Darden Restaurants Inc. Common Stock,Restaurants
DRIO,DRIO,DarioHealth Corp. Common Stock,Medical/Dental Instruments
DRMA,DRMA,Dermata Therapeutics Inc. Common Stock,Biotechnology: Pharmaceutical Preparations
DRMAW,DRMAW,Dermata Therapeutics Inc. Warrant,Biotechnology: Pharmaceutical Preparations
DRRX,DRRX,DURECT Corporation Common Stock,Biotechnology: Pharmaceutical Preparations
DRS,DRS,Leonardo DRS Inc. Common Stock,Industrial Machinery/Components
DRTS,DRTS,Alpha Tau Medical Ltd. Ordinary Shares,Medical/Dental Instruments
DRTSW,DRTSW,Alpha Tau Medical Ltd. Warrant,Medical/Dental Instruments
DRUG,DRUG,Bright Minds Biosciences Inc. Common Stock,Biotechnology: Pharmaceutical Preparations
