code,tickers,name,industry
IKNA,IKNA,Ikena Oncology Inc. Common Stock,Biotechnology: Biological Products (No Diagnostic Substances)
IKT,IKT,Inhibikase Therapeutics Inc. Common Stock,Biotechnology: Biological Products (No Diagnostic Substances)
ILAG,ILAG,Intelligent Living Application Group Inc. Ordinary Shares,Office Equipment/Supplies/Services
ILLR,ILLR,Triller Group Inc. Common Stock,Investment Managers
ILLRW,ILLRW,Triller Group Inc. Warrant,Investment Managers
ILMN,ILMN,Illumina Inc. Common Stock,Medical Specialities
ILPT,ILPT,Industrial Logistics Properties Trust Common Shares of Beneficial Interest,Real Estate Investment Trusts
IMAB,IMAB,I-MAB American Depositary Shares,Biotechnology: Pharmaceutical Preparations
IMAX,IMAX,Imax Corporation Common Stock,Industrial Machinery/Components
IMCC,IMCC,IM Cannabis Corp. Common Shares,Medicinal Chemicals and Botanical Products
IMCR,IMCR,Immunocore Holdings plc American Depositary Shares,Biotechnology: Biological Products (No Diagnostic Substances)
IMG,IMG,CIMG Inc. Common Stock,Other Specialty Stores
IMKTA,IMKTA,Ingles Markets Incorporated Class A Common Stock,Food Chains
IMMP,IMMP,Immutep Limited American Depositary Shares,Biotechnology: Pharmaceutical Preparations
IMMR,IMMR,Immersion Corporation Common Stock,Computer peripheral equipment
IMMX,IMMX,Immix Biopharma Inc. Common Stock,Biotechnology: Pharmaceutical Preparations
IMNM,IMNM,Immunome Inc. Common Stock,Biotechnology: Pharmaceutical Preparations
IMNN,IMNN,Imunon Inc. Common Stock,Biotechnology: Pharmaceutical Preparations
IMO,IMO,Imperial Oil Limited Common Stock,Integrated oil Companies
IMOS,IMOS,ChipMOS TECHNOLOGIES INC. American Depositary Shares,Semiconductors
IMPP,IMPP,Imperial Petroleum Inc. Common Shares,Marine Transportation
IMPPP,IMPPP,Imperial Petroleum Inc. 8.75% Series A Cumulative Redeemable Perpetual Preferred Shares,Marine Transportation
IMRN,IMRN,Immuron Limited American Depositary Shares,Biotechnology: Pharmaceutical Preparations
IMRX,IMRX,Immuneering Corporation Class A Common Stock,Biotechnology: Pharmaceutical Preparations
IMTE,IMTE,Integrated Media Technology Limited Ordinary Shares,Consumer Electronics/Appliances
IMTX,IMTX,Immatics N.V. Ordinary Shares,Biotechnology: Biological Products (No Diagnostic Substances)
IMTXW,IMTXW,Immatics N.V. Warrants,Biotechnology: Biological Products (No Diagnostic Substances)
IMUX,IMUX,Immunic Inc. Common Stock,Biotechnology: Pharmaceutical Preparations
IMVT,IMVT,Immunovant Inc. Common Stock,Biotechnology: Biological Products (No Diagnostic Substances)
IMXI,IMXI,International Money Express Inc. Common Stock,Business Services
INAB,INAB,IN8bio Inc. Common Stock,Biotechnology: Biological Products (No Diagnostic Substances)
INAQ,INAQ,Insight Acquisition Corp. Class A Common Stock,Blank Checks
INAQU,INAQU,Insight Acquisition Corp. Units,Blank Checks
INAQW,INAQW,Insight Acquisition Corp. Warrant,Blank Checks
INBK,INBK,First Internet Bancorp Common Stock,Major Banks
INBKZ,INBKZ,First Internet Bancorp 6.0% Fixed-to-Floating Rate Subordinated Notes Due 2029,Major Banks
INBS,INBS,Intelligent Bio Solutions Inc. Common Stock,Medical/Dental Instruments
INBX,INBX,Inhibrx Biosciences Inc. Common Stock,Biotechnology: Biological Products (No Diagnostic Substances)
INCR,INCR,Intercure Ltd. Ordinary Shares,Biotechnology: Pharmaceutical Preparations
INCY,INCY,Incyte Corp. Common Stock,Biotechnology: Commercial Physical & Biological Resarch
INDB,INDB,Independent Bank Corp. Common Stock,Major Banks
INDI,INDI,indie Semiconductor Inc. Class A Common Stock,Semiconductors
INDO,INDO,Indonesia Energy Corporation Limited Ordinary Shares,Oil & Gas Production
INDP,INDP,Indaptus Therapeutics Inc. Common Stock,Biotechnology: Pharmaceutical Preparations
INDV,INDV,Indivior PLC Ordinary Shares,Biotechnology: Pharmaceutical Preparations
INFA,INFA,Informatica Inc. Class A Common Stock,Computer Software: Prepackaged Software
INFN,INFN,Infinera Corporation Common Stock,Telecommunications Equipment
INFU,INFU,InfuSystems Holdings Inc. Common Stock,Medical/Dental Instruments
INFY,INFY,Infosys Limited American Depositary Shares,EDP Services
ING,ING,ING Group N.V. Common Stock,Commercial Banks
INGM,INGM,Ingram Micro Holding Corporation Common Stock,Retail: Computer Software & Peripheral Equipment
INGN,INGN,Inogen Inc Common Stock,Industrial Specialties
INGR,INGR,Ingredion Incorporated Common Stock,Packaged Foods
INHD,INHD,Inno Holdings Inc. Common Stock,Steel/Iron Ore
INKT,INKT,MiNK Therapeutics Inc. Common Stock,Biotechnology: Biological Products (No Diagnostic Substances)
INLX,INLX,Intellinetics Inc. Common Stock,Computer Software: Prepackaged Software
INM,INM,InMed Pharmaceuticals Inc. Common Shares,Biotechnology: Pharmaceutical Preparations
INMB,INMB,INmune Bio Inc. Common stock,Biotechnology: Biological Products (No Diagnostic Substances)
INMD,INMD,InMode Ltd. Ordinary Shares,Biotechnology: Electromedical & Electrotherapeutic Apparatus
INN,INN,Summit Hotel Properties Inc. Common Stock,Real Estate Investment Trusts
INN^E,INN^E,Summit Hotel Properties Inc. 6.250% Series E Cumulative Redeemable Preferred Stock,NA
INN^F,INN^F,Summit Hotel Properties Inc. 5.875% Series F Cumulative Redeemable Preferred Stock $0.01 par value per share,NA
INNV,INNV,InnovAge Holding Corp. Common Stock,Medical/Nursing Services
INO,INO,Inovio Pharmaceuticals Inc. Common Stock,Medical/Dental Instruments
INOD,INOD,Innodata Inc. Common Stock,EDP Services
INSE,INSE,Inspired Entertainment Inc. Common Stock,Computer Software: Prepackaged Software
INSG,INSG,Inseego Corp. Common Stock,Telecommunications Equipment
INSI,INSI,Insight Select Income Fund,Investment Managers
INSM,INSM,Insmed Incorporated Common Stock,Biotechnology: Pharmaceutical Preparations
INSP,INSP,Inspire Medical Systems Inc. Common Stock,Medical/Dental Instruments
INSW,INSW,International Seaways Inc. Common Stock,Marine Transportation
INTA,INTA,Intapp Inc. Common Stock,Computer Software: Prepackaged Software
INTC,INTC,Intel Corporation Common Stock,Semiconductors
INTG,INTG,Intergroup Corporation (The) Common Stock,Building operators
INTJ,INTJ,Intelligent Group Limited Ordinary Shares,Professional Services
INTR,INTR,Inter & Co. Inc. Class A Common Shares,Commercial Banks
INTS,INTS,Intensity Therapeutics Inc. Common stock,Biotechnology: Biological Products (No Diagnostic Substances)
INTT,INTT,inTest Corporation Common Stock,Electrical Products
INTU,INTU,Intuit Inc. Common Stock,Computer Software: Prepackaged Software
INTZ,INTZ,Intrusion Inc. Common Stock,Computer Communications Equipment
INUV,INUV,Inuvo Inc.,Advertising
INV,INV,Innventure Inc. Common Stock,Blank Checks
INVA,INVA,Innoviva Inc. Common Stock,Biotechnology: Pharmaceutical Preparations
INVE,INVE,Identiv Inc. Common Stock,Computer peripheral equipment
INVH,INVH,Invitation Homes Inc. Common Stock,Real Estate
INVX,INVX,Innovex International Inc. Common Stock,Metal Fabrications
INVZ,INVZ,Innoviz Technologies Ltd. Ordinary shares,Auto Parts:O.E.M.
INVZW,INVZW,Innoviz Technologies Ltd. Warrant,Auto Parts:O.E.M.
INZY,INZY,Inozyme Pharma Inc. Common Stock,Biotechnology: Pharmaceutical Preparations
IOBT,IOBT,IO Biotech Inc. Common Stock,Biotechnology: Pharmaceutical Preparations
IONQ,IONQ,IonQ Inc. Common Stock,EDP Services
IONR,IONR,ioneer Ltd American Depositary Shares,Mining & Quarrying of Nonmetallic Minerals (No Fuels)
IONS,IONS,Ionis Pharmaceuticals Inc. Common Stock,Biotechnology: Pharmaceutical Preparations
IOR,IOR,Income Opportunity Realty Investors Inc. Common Stock,Real Estate Investment Trusts
IOSP,IOSP,Innospec Inc. Common Stock,Major Chemicals
IOT,IOT,Samsara Inc. Class A Common Stock,EDP Services
IOVA,IOVA,Iovance Biotherapeutics Inc. Common Stock,Biotechnology: Biological Products (No Diagnostic Substances)
IP,IP,International Paper Company Common Stock,Paper
IPA,IPA,ImmunoPrecise Antibodies Ltd. Common Stock,Biotechnology: Pharmaceutical Preparations
IPAR,IPAR,Interparfums Inc. Common Stock,Package Goods/Cosmetics
IPDN,IPDN,Professional Diversity Network Inc. Common Stock,Computer Software: Programming Data Processing
IPG,IPG,Interpublic Group of Companies Inc. (The) Common Stock,Advertising
IPGP,IPGP,IPG Photonics Corporation Common Stock,Semiconductors
IPHA,IPHA,Innate Pharma S.A. ADS,Biotechnology: Biological Products (No Diagnostic Substances)
IPI,IPI,Intrepid Potash Inc Common Stock,Mining & Quarrying of Nonmetallic Minerals (No Fuels)
IPSC,IPSC,Century Therapeutics Inc. Common Stock,Biotechnology: Biological Products (No Diagnostic Substances)
IPW,IPW,iPower Inc. Common Stock,RETAIL: Building Materials
IPWR,IPWR,Ideal Power Inc. Common Stock,Semiconductors
IPX,IPX,IperionX Limited American Depositary Share,Other Metals and Minerals
IPXX,IPXX,Inflection Point Acquisition Corp. II Class A Ordinary Share,Blank Checks
IPXXU,IPXXU,Inflection Point Acquisition Corp. II Unit,Blank Checks
IPXXW,IPXXW,Inflection Point Acquisition Corp. II Warrant,Blank Checks
IQ,IQ,iQIYI Inc. American Depositary Shares,Consumer Electronics/Video Chains
IQI,IQI,Invesco Quality Municipal Income Trust Common Stock,Finance Companies
IQV,IQV,IQVIA Holdings Inc. Common Stock,Biotechnology: Commercial Physical & Biological Resarch
IR,IR,Ingersoll Rand Inc. Common Stock,Industrial Machinery/Components
IRBT,IRBT,iRobot Corporation Common Stock,Consumer Electronics/Appliances
IRD,IRD,Opus Genetics Inc. Common Stock,Biotechnology: Pharmaceutical Preparations
IRDM,IRDM,Iridium Communications Inc Common Stock,Telecommunications Equipment
IREN,IREN,IREN Limited Ordinary Shares,EDP Services
IRIX,IRIX,IRIDEX Corporation Common Stock,Biotechnology: Electromedical & Electrotherapeutic Apparatus
IRM,IRM,Iron Mountain Incorporated (Delaware)Common Stock REIT,Real Estate Investment Trusts
IRMD,IRMD,iRadimed Corporation Common Stock,Medical/Dental Instruments
IROH,IROH,Iron Horse Acquisitions Corp. Common Stock,NA
IROHR,IROHR,Iron Horse Acquisitions Corp. Right,NA
IROHU,IROHU,Iron Horse Acquisitions Corp. Unit,NA
IROHW,IROHW,Iron Horse Acquisitions Corp. Warrant,NA
IRON,IRON,Disc Medicine Inc. Common Stock,Biotechnology: Pharmaceutical Preparations
IROQ,IROQ,IF Bancorp Inc. Common Stock,Savings Institutions
IRS,IRS,IRSA Inversiones Y Representaciones S.A. Global Depositary Shares (Each representing ten shares of Common Stock),Homebuilding
IRT,IRT,Independence Realty Trust Inc. Common Stock,Real Estate Investment Trusts
IRTC,IRTC,iRhythm Technologies Inc. Common Stock,Medical/Dental Instruments
IRWD,IRWD,Ironwood Pharmaceuticals Inc. Class A Common Stock,Biotechnology: Pharmaceutical Preparations
ISD,ISD,PGIM High Yield Bond Fund Inc.,Trusts Except Educational Religious and Charitable
ISDR,ISDR,Issuer Direct Corporation Common Stock,Publishing
ISPC,ISPC,iSpecimen Inc. Common Stock,Biotechnology: Commercial Physical & Biological Resarch
ISPO,ISPO,Inspirato Incorporated Class A Common Stock,Blank Checks
ISPOW,ISPOW,Inspirato Incorporated Warrant,Blank Checks
ISPR,ISPR,Ispire Technology Inc. Common Stock,Medicinal Chemicals and Botanical Products
ISRG,ISRG,Intuitive Surgical Inc. Common Stock,Industrial Specialties
ISRL,ISRL,Israel Acquisitions Corp Class A Ordinary Shares,Blank Checks
ISRLW,ISRLW,Israel Acquisitions Corp Warrant,Blank Checks
ISSC,ISSC,Innovative Solutions and Support Inc. Common Stock,EDP Services
ISTR,ISTR,Investar Holding Corporation Common Stock,Major Banks
IT,IT,Gartner Inc. Common Stock,Other Consumer Services
ITCI,ITCI,Intra-Cellular Therapies Inc. Common Stock,Biotechnology: Pharmaceutical Preparations
ITGR,ITGR,Integer Holdings Corporation Common Stock,Biotechnology: Electromedical & Electrotherapeutic Apparatus
ITIC,ITIC,Investors Title Company Common Stock,Specialty Insurers
ITOS,ITOS,iTeos Therapeutics Inc. Common Stock,Biotechnology: Biological Products (No Diagnostic Substances)
ITP,ITP,IT Tech Packaging Inc. Common Stock,Containers/Packaging
ITRG,ITRG,Integra Resources Corp. Common Shares,Precious Metals
ITRI,ITRI,Itron Inc. Common Stock,Electrical Products
ITRM,ITRM,Iterum Therapeutics plc Ordinary Share,Biotechnology: Pharmaceutical Preparations
ITRN,ITRN,Ituran Location and Control Ltd. Ordinary Shares,Electronic Components
ITT,ITT,ITT Inc. Common Stock,Fluid Controls
ITUB,ITUB,Itau Unibanco Banco Holding SA American Depositary Shares (Each repstg 500 Preferred shares),Major Banks
ITW,ITW,Illinois Tool Works Inc. Common Stock,Industrial Machinery/Components
IVA,IVA,Inventiva S.A. American Depository Shares,Biotechnology: Pharmaceutical Preparations
IVAC,IVAC,Intevac Inc. Common Stock,Industrial Machinery/Components
IVCA,IVCA,Investcorp AI Acquisition Corp. Class A Ordinary Share,Blank Checks
IVCAW,IVCAW,Investcorp AI Acquisition Corp. Warrant,Blank Checks
IVCB,IVCB,Investcorp Europe Acquisition Corp I Class A Ordinary Shares,Blank Checks
IVCBW,IVCBW,Investcorp Europe Acquisition Corp I Warrant,Blank Checks
IVCP,IVCP,Swiftmerge Acquisition Corp. Class A Ordinary Share,Blank Checks
IVCPU,IVCPU,Swiftmerge Acquisition Corp. Unit,Blank Checks
IVCPW,IVCPW,Swiftmerge Acquisition Corp. Warrants,Blank Checks
IVDA,IVDA,Iveda Solutions Inc. Common Stock,Computer Software: Prepackaged Software
IVP,IVP,Inspire Veterinary Partners Inc. Class A Common Stock,Farming/Seeds/Milling
IVR,IVR,INVESCO MORTGAGE CAPITAL INC Common Stock,Real Estate Investment Trusts
IVR^B,IVR^B,Invesco Mortgage Capital Inc. Preferred Series B Cum Fxd to Fltg,NA
IVR^C,IVR^C,INVESCO MORTGAGE CAPITAL INC 7.5% Fixed-to-Floating Series C Cumulative Redeemable Preferred Stock Liquation Preference $25.00 per Share,NA
IVT,IVT,InvenTrust Properties Corp. Common Stock,Real Estate Investment Trusts
IVVD,IVVD,Invivyd Inc. Common Stock,Biotechnology: Biological Products (No Diagnostic Substances)
IVZ,IVZ,Invesco Ltd Common Stock,Investment Managers
IX,IX,Orix Corp Ads Common Stock,Diversified Financial Services
IXHL,IXHL,Incannex Healthcare Inc. Common Stock,Biotechnology: Pharmaceutical Preparations
IZEA,IZEA,IZEA Worldwide Inc. Common Stock,Advertising
IZM,IZM,ICZOOM Group Inc. Class A Ordinary Shares,Consumer Electronics/Video Chains
IZTC,IZTC,Invizyne Technologies Inc. Common Stock,Biotechnology: Biological Products (No Diagnostic Substances)
J,J,Jacobs Solutions Inc. Common Stock,Military/Government/Technical
JACK,JACK,Jack In The Box Inc. Common Stock,Restaurants
JAGX,JAGX,Jaguar Health Inc. Common Stock,Biotechnology: Pharmaceutical Preparations
JAKK,JAKK,JAKKS Pacific Inc. Common Stock,Recreational Games/Products/Toys
JAMF,JAMF,Jamf Holding Corp. Common Stock,Computer Software: Prepackaged Software
JANX,JANX,Janux Therapeutics Inc. Common Stock,Biotechnology: Pharmaceutical Preparations
JAZZ,JAZZ,Jazz Pharmaceuticals plc Common Stock (Ireland),Biotechnology: Pharmaceutical Preparations
JBDI,JBDI,JBDI Holdings Limited Ordinary Shares,NA
JBGS,JBGS,JBG SMITH Properties Common Shares,Real Estate Investment Trusts
JBHT,JBHT,J.B. Hunt Transport Services Inc. Common Stock,Trucking Freight/Courier Services
JBI,JBI,Janus International Group Inc. Common Stock,Building Products
JBL,JBL,Jabil Inc. Common Stock,Electrical Products
JBLU,JBLU,JetBlue Airways Corporation Common Stock,Air Freight/Delivery Services
JBSS,JBSS,John B. Sanfilippo & Son Inc. Common Stock,Specialty Foods
JBT,JBT,John Bean Technologies Corporation Common Stock,Industrial Machinery/Components
JCE,JCE,Nuveen Core Equity Alpha Fund Common Shares of Beneficial Interest,Trusts Except Educational Religious and Charitable
JCI,JCI,Johnson Controls International plc Ordinary Share,Industrial Machinery/Components
JCSE,JCSE,JE Cleantech Holdings Limited Ordinary Shares,Miscellaneous manufacturing industries
JCTC,JCTC,Jewett-Cameron Trading Company Common Shares,RETAIL: Building Materials
JD,JD,JD.com Inc. American Depositary Shares,Other Specialty Stores
JDZG,JDZG,JIADE LIMITED Common stock,Other Consumer Services
JEF,JEF,Jefferies Financial Group Inc. Common Stock,Investment Bankers/Brokers/Service
JELD,JELD,JELD-WEN Holding Inc. Common Stock,Forest Products
JEQ,JEQ,abrdn Japan Equity Fund Inc. Common Stock,Air Freight/Delivery Services
JFBR,JFBR,Jeffs' Brands Ltd Ordinary Shares,Other Specialty Stores
JFBRW,JFBRW,Jeffs' Brands Ltd Warrant,Other Specialty Stores
JFIN,JFIN,Jiayin Group Inc. American Depositary Shares,Finance: Consumer Services
JFR,JFR,Nuveen Floating Rate Income Fund Common Stock,Trusts Except Educational Religious and Charitable
JFU,JFU,9F Inc. American Depositary Shares,Finance: Consumer Services
JG,JG,Aurora Mobile Limited American Depositary Shares,Computer Software: Programming Data Processing
JGH,JGH,Nuveen Global High Income Fund Common Shares of Beneficial Interest,Investment Managers
JHG,JHG,Janus Henderson Group plc Ordinary Shares,Investment Managers
JHI,JHI,John Hancock Investors Trust Common Stock,Trusts Except Educational Religious and Charitable
JHS,JHS,John Hancock Income Securities Trust Common Stock,Finance Companies
JHX,JHX,James Hardie Industries plc American Depositary Shares (Ireland),Building Materials
JILL,JILL,J. Jill Inc. Common Stock,Apparel
JJSF,JJSF,J & J Snack Foods Corp. Common Stock,Specialty Foods
JKHY,JKHY,Jack Henry & Associates Inc. Common Stock,EDP Services
JKS,JKS,JinkoSolar Holding Company Limited American Depositary Shares (each representing 4 Common Shares),Semiconductors
JL,JL,J-Long Group Limited Ordinary Shares,Clothing/Shoe/Accessory Stores
JLL,JLL,Jones Lang LaSalle Incorporated Common Stock,Real Estate
JLS,JLS,Nuveen Mortgage and Income Fund,Investment Managers
JMIA,JMIA,Jumia Technologies AG American Depositary Shares each representing two Ordinary Shares,Catalog/Specialty Distribution
JMM,JMM,Nuveen Multi-Market Income Fund (MA),Trusts Except Educational Religious and Charitable
JMSB,JMSB,John Marshall Bancorp Inc. Common Stock,Major Banks
JNJ,JNJ,Johnson & Johnson Common Stock,Biotechnology: Pharmaceutical Preparations
JNPR,JNPR,Juniper Networks Inc. Common Stock,Computer Communications Equipment
JNVR,JNVR,Janover Inc. Common Stock,Finance: Consumer Services
JOB,JOB,GEE Group Inc. Common Stock,Diversified Commercial Services
JOBY,JOBY,Joby Aviation Inc. Common Stock,Aerospace
JOE,JOE,St. Joe Company (The) Common Stock,Homebuilding
JOF,JOF,Japan Smaller Capitalization Fund Inc Common Stock,Trusts Except Educational Religious and Charitable
JOUT,JOUT,Johnson Outdoors Inc. Class A Common Stock,Recreational Games/Products/Toys
JPC,JPC,Nuveen Preferred & Income Opportunities Fund,Investment Managers
JPI,JPI,Nuveen Preferred Securities & Income Opportunities Fund Common Shares,Finance Companies
JPM,JPM,JP Morgan Chase & Co. Common Stock,Major Banks
JPM^C,JPM^C,J P Morgan Chase & Co Depositary Shares each representing a 1/400th interest in a share of 6.00% Non-Cumulative  Preferred Stock Series EE,NA
JPM^D,JPM^D,J P Morgan Chase & Co Depositary Shares each representing a 1/400th  interest in a share of 5.75% Non-Cumulative  Preferred Stock Series DD,NA
JPM^J,JPM^J,J P Morgan Chase & Co Depositary Shares each representing a 1/400th interest in a share of JPMorgan Chase & Co. 4.75% Non-Cumulative Preferred Stock Series GG,NA
JPM^K,JPM^K,J P Morgan Chase & Co Depositary Shares each representing a 1/400th interest in a share of 4.55% Non-Cumulative Preferred Stock Series JJ,NA
JPM^L,JPM^L,J P Morgan Chase & Co Depositary Shares each representing a 1/400th interest in a share of 4.625% Non-Cumulative Preferred Stock Series LL,NA
JPM^M,JPM^M,J P Morgan Chase & Co Depositary Shares each representing a 1/400th interest in a share of 4.20% Non-Cumulative Preferred Stock Series MM,NA
JQC,JQC,Nuveen Credit Strategies Income Fund Shares of Beneficial Interest,Finance Companies
JRI,JRI,Nuveen Real Asset Income and Growth Fund Common Shares of Beneficial Interest,Finance Companies
JRS,JRS,Nuveen Real Estate Income Fund Common Shares of Beneficial Interest,Finance/Investors Services
JRSH,JRSH,Jerash Holdings (US) Inc. Common Stock,Apparel
JRVR,JRVR,James River Group Holdings Ltd. Common Shares,Property-Casualty Insurers
JSM,JSM,Navient Corporation 6% Senior Notes due December 15 2043,Investment Bankers/Brokers/Service
JSPR,JSPR,Jasper Therapeutics Inc. Common Stock,Biotechnology: Biological Products (No Diagnostic Substances)
JSPRW,JSPRW,Japer Therapeutics Inc. Warrants,Biotechnology: Biological Products (No Diagnostic Substances)
JTAI,JTAI,Jet.AI Inc. Common Stock,Transportation Services
JUNE,JUNE,Junee Limited Ordinary Shares,NA
JUNS,JUNS,Jupiter Neurosciences Inc. Common Stock,Biotechnology: Pharmaceutical Preparations
JVA,JVA,Coffee Holding Co. Inc. Common Stock,Packaged Foods
JVSA,JVSA,JV SPAC Acquisition Corp. Class A Ordinary Share,NA
JWEL,JWEL,Jowell Global Ltd. Ordinary Shares,Other Consumer Services
JWN,JWN,Nordstrom Inc. Common Stock,Clothing/Shoe/Accessory Stores
JXJT,JXJT,JX Luxventure Limited Common Stock,Apparel
JXN,JXN,Jackson Financial Inc. Class A Common Stock,Life Insurance
JXN^A,JXN^A,Jackson Financial Inc. Depositary Shares each representing a 1/1000th interest in a share of Fixed-Rate Reset Noncumulative Perpetual Preferred Stock Series A,NA
JYD,JYD,Jayud Global Logistics Limited Class A Ordinary Shares,Oil Refining/Marketing
JYNT,JYNT,The Joint Corp. Common Stock,Multi-Sector Companies
JZ,JZ,Jianzhi Education Technology Group Company Limited American Depositary Shs,Other Consumer Services
JZXN,JZXN,Jiuzi Holdings Inc. Ordinary Shares,Retail-Auto Dealers and Gas Stations
K,K,Kellanova Common Stock,Packaged Foods
KACL,KACL,Kairous Acquisition Corp. Limited Ordinary Shares,Blank Checks
KACLR,KACLR,Kairous Acquisition Corp. Limited Rights,Blank Checks
KACLW,KACLW,Kairous Acquisition Corp. Limited Warrants,Blank Checks
KAI,KAI,Kadant Inc Common Stock,Industrial Machinery/Components
KALA,KALA,KALA BIO Inc. Common Stock,Biotechnology: Pharmaceutical Preparations
KALU,KALU,Kaiser Aluminum Corporation Common Stock,Metal Fabrications
KALV,KALV,KalVista Pharmaceuticals Inc. Common Stock,Biotechnology: Pharmaceutical Preparations
KAPA,KAPA,Kairos Pharma Ltd. Common Stock,Biotechnology: Pharmaceutical Preparations
KAR,KAR,OPENLANE Inc. Common Stock,Retail-Auto Dealers and Gas Stations
KARO,KARO,Karooooo Ltd. Ordinary Shares,Computer Software: Prepackaged Software
KAVL,KAVL,Kaival Brands Innovations Group Inc. Common Stock,Other Consumer Services
KB,KB,KB Financial Group Inc,Commercial Banks
KBDC,KBDC,Kayne Anderson BDC Inc. Common Stock,NA
KBH,KBH,KB Home Common Stock,Homebuilding
KBR,KBR,KBR Inc. Common Stock,Military/Government/Technical
KC,KC,Kingsoft Cloud Holdings Limited American Depositary Shares,Computer Software: Prepackaged Software
KD,KD,Kyndryl Holdings Inc. Common Stock,EDP Services
KDLY,KDLY,Kindly MD Inc. Common Stock,Medical/Nursing Services
KDLYW,KDLYW,Kindly MD Inc. Warrants,Medical/Nursing Services
KDP,KDP,Keurig Dr Pepper Inc. Common Stock,Beverages (Production/Distribution)
KE,KE,Kimball Electronics Inc. Common Stock,Electrical Products
KELYA,KELYA,Kelly Services Inc. Class A Common Stock,Professional Services
KELYB,KELYB,Kelly Services Inc. Class B Common Stock,Professional Services
KEN,KEN,Kenon Holdings Ltd. Ordinary Shares,Electric Utilities: Central
KEP,KEP,Korea Electric Power Corporation Common Stock,Electric Utilities: Central
KEQU,KEQU,Kewaunee Scientific Corporation Common Stock,Medical Specialities
KEX,KEX,Kirby Corporation Common Stock,Marine Transportation
KEY,KEY,KeyCorp Common Stock,Major Banks
KEY^I,KEY^I,KeyCorp Depositary Shares Each Representing a 1/40th Ownership Interest in a Share of Fixed-to-Floating Rate Perpetual Non-Cumulative Preferred Stock Series E,NA
KEY^J,KEY^J,KeyCorp Depositary Shares each representing a 1/40th ownership interest in a share of Fixed Rate Perpetual Non-Cumulative Preferred Stock Series F,NA
KEY^K,KEY^K,KeyCorp Depositary Shares each representing a 1/40th ownership interest in a share of Fixed Rate Perpetual Non-Cumulative Preferred Stock Series G,NA
KEY^L,KEY^L,KeyCorp Depositary Shares each representing a 1/40th ownership interest in a share of Fixed Rate Perpetual Non-Cumulative Preferred Stock Series H,NA
KEYS,KEYS,Keysight Technologies Inc. Common Stock,Industrial Machinery/Components
KF,KF,Korea Fund Inc. (The) New Common Stock,Investment Managers
KFFB,KFFB,Kentucky First Federal Bancorp Common Stock,Savings Institutions
KFRC,KFRC,Kforce Inc. Common Stock,Professional Services
KFS,KFS,Kingsway Financial Services Inc. Common Stock (DE),Property-Casualty Insurers
KFY,KFY,Korn Ferry Common Stock,Diversified Commercial Services
KGC,KGC,Kinross Gold Corporation Common Stock,Precious Metals
KGEI,KGEI,Kolibri Global Energy Inc. Common stock,Oil & Gas Production
KGS,KGS,Kodiak Gas Services Inc. Common Stock,Natural Gas Distribution
KHC,KHC,The Kraft Heinz Company Common Stock,Packaged Foods
KIDS,KIDS,OrthoPediatrics Corp. Common Stock,Medical/Dental Instruments
KIM,KIM,Kimco Realty Corporation (HC) Common Stock,Real Estate Investment Trusts
KIM^L,KIM^L,Kimco Realty Corporation Class L Depositary Shares each of which represents a one-one thousandth fractional interest in a share of 5.125% Class L Cumulative Redeemable Preferred Stock liquidation preference $25000.00 per share,NA
KIM^M,KIM^M,Kimco Realty Corporation Class M Depositary Shares each of which represents a one-one thousandth fractional interest in a share of 5.25% Class M Cumulative Redeemable Preferred Stock liquidation preference $25000.00 per share,NA
KIM^N,KIM^N,Kimco Realty Corporation Depositary Shares each representing 1/1000th interest in a share of 7.25% Class N Cumulative Convertible Perpetual Preferred Stock,NA
KIND,KIND,Nextdoor Holdings Inc. Class A Common Stock,Computer Software: Programming Data Processing
KINS,KINS,Kingstone Companies Inc. Common Stock,Property-Casualty Insurers
KIO,KIO,KKR Income Opportunities Fund Common Shares,Investment Managers
KIRK,KIRK,Kirkland's Inc. COMMONSTOCK,Other Specialty Stores
KITT,KITT,Nauticus Robotics Inc. Common stock,Industrial Machinery/Components
KITTW,KITTW,Nauticus Robotics Inc. Warrant,Industrial Machinery/Components
